{
  "$schema": "../../schema/rule.v1.json",
  "id": "us-federal-form-990-ez",
  "jurisdiction": "US",
  "title": "Form 990-EZ — Short Form Return of Organization Exempt From Income Tax",
  "agency": "Internal Revenue Service",
  "entityTypes": ["501c3"],
  "cadence": { "type": "annual", "anchor": "fiscal-year-end", "offsetMonths": 5, "dayOfMonth": 15 },
  "form": "990-EZ",
  "conditions": [
    { "fact": "grossRevenueMinorUnits", "op": "gt", "value": 5000000 },
    { "fact": "grossRevenueMinorUnits", "op": "lt", "value": 20000000 },
    { "fact": "totalAssetsMinorUnits", "op": "lt", "value": 50000000 }
  ],
  "citation": "26 U.S.C. 6033; IRS Instructions for Form 990-EZ",
  "citationUrl": "https://www.irs.gov/forms-pubs/about-form-990-ez",
  "lastVerified": "2026-08-01",
  "status": "draft",
  "effectiveFrom": "2020-01-01",
  "notes": "Filing thresholds are reviewed by the IRS periodically; re-check the current instructions before promoting to active."
}
