{
  "$schema": "../../schema/rule.v1.json",
  "id": "us-federal-form-990",
  "jurisdiction": "US",
  "title": "Form 990 — Return of Organization Exempt From Income Tax",
  "agency": "Internal Revenue Service",
  "entityTypes": ["501c3"],
  "cadence": { "type": "annual", "anchor": "fiscal-year-end", "offsetMonths": 5, "dayOfMonth": 15 },
  "form": "990",
  "conditions": [
    { "fact": "grossRevenueMinorUnits", "op": "gte", "value": 20000000 }
  ],
  "citation": "26 U.S.C. 6033; IRS Instructions for Form 990",
  "citationUrl": "https://www.irs.gov/forms-pubs/about-form-990",
  "lastVerified": "2026-08-01",
  "status": "draft",
  "effectiveFrom": "2020-01-01",
  "notes": "Due the 15th day of the 5th month after the fiscal year ends — 15 May for a calendar-year filer. INCOMPLETE: the real threshold is gross receipts >= $200k OR total assets >= $500k, and conditions are AND-only, so an organisation with low receipts but large assets is currently missed. See the OR-conditions issue before promoting to active."
}
