{
  "$schema": "../../schema/rule.v1.json",
  "id": "us-wa-charitable-solicitation-registration",
  "jurisdiction": "US-WA",
  "title": "Charitable Organization Registration Renewal",
  "agency": "Washington Secretary of State, Charities Program",
  "entityTypes": [
    "501c3",
    "nonprofit-corp"
  ],
  "cadence": {
    "type": "annual",
    "anchor": "fiscal-year-end",
    "offsetMonths": 11,
    "dayOfMonth": "last"
  },
  "fee": {
    "amountMinorUnits": 4000,
    "currency": "USD"
  },
  "conditions": [
    {
      "fact": "solicitsCharitableContributions",
      "op": "eq",
      "value": true
    }
  ],
  "citation": "RCW 19.09.075; RCW 19.09.085; WAC 434-120-140(2)(a); WAC 434-120-042",
  "citationUrl": "https://app.leg.wa.gov/wac/default.aspx?cite=434-120-140",
  "agencyUrl": "https://www.sos.wa.gov/corporations-charities/charities",
  "lastVerified": "2026-08-05",
  "status": "draft",
  "effectiveFrom": "2020-01-01",
  "notes": "NARROWED 2026-08-05 (NEH-401): this rule used to ALSO trigger on holding $250,000+ in charitable assets, which is a different registration entirely — RCW 11.110 charitable TRUST registration, now us-wa-charitable-trust-registration. The deadlines coincide (both are the last business day of the eleventh month after the accounting year, WAC 434-120-025), which is why merging them looked harmless; the forms and the fees do not. An endowed non-soliciting charity was being sent to the wrong form at $40 instead of $25. FEE VERIFIED TWICE, independently: RCW 19.09.062(2) and WAC 434-120-042 both give $40 for a charitable organization ANNUAL RENEWAL against $60 for an initial registration. This rule is the renewal. DEADLINE VERIFIED, WAC 434-120-140(2)(a) VERBATIM: 'The completed form and fee shall be received no later than the last business day of the eleventh month after the end of the organization's accounting year.' The statute does NOT set this — RCW 19.09.085(2) delegates it to the secretary by rule — so the WAC is the citation that matters. KNOWN FALSE POSITIVE, NOT EXPRESSIBLE YET: RCW 19.09.081 EXEMPTS an organisation 'raising less than fifty thousand dollars in any accounting year when all the activities of the organization, including all fund-raising activities, are carried on by persons who are unpaid'. This rule cannot express that. It needs two facts the model does not have — contributions RAISED (grossRevenueMinorUnits is a different quantity: a nonprofit can have program revenue that is not contributions) and whether all fundraising is unpaid. So a small all-volunteer charity is told to register when it need not, which costs it $60 and an afternoon. Tracked separately; expressing it wrong would be worse than leaving it. KNOWN WRONG, NOT FIXABLE IN THIS SCHEMA: last BUSINESS day vs last calendar day — see NEH-404. AGENCY URL NOT CLICKABLE FROM CI: sos.wa.gov returns 403 to every automated request — including its own root and a path that does not exist, so the status carries no information about whether a URL is real. This one is the agency's own published page (search engines have crawled it) but nobody here has opened it. A person must, once. See NEH-402."
}
